{
  "schemaVersion": 1,
  "status": "draft",
  "notes": [
    "No fragments or evidence records yet. Find_Your_Class_Product_Architecture_v1.md section 15 gives illustrative prose examples only (not a specified fragment catalogue with stable ids), and section 19 requires every public claim to resolve to reviewed evidence -- fabricating fragment content here would misrepresent it as authored/reviewed. This file exists so the loader and schema validate against a real (empty) instance; Codex adds fragments/evidence as part of the pilot catalogue package (blueprint section 14, Package A/B)."
  ],
  "fragments": [],
  "evidence": []
}
